{
  "$schema": "https://json-schema.org/draft/2020-12/schema",
  "title": "sherpa harness state",
  "description": "What sherpa owns in the repo and the hash it wrote (.sherpa/state.json). Written by `sherpa apply`, read by `apply`, `status` and the outcome hook (harness_rev). Unknown top-level keys are tolerated so an older sherpa can read a newer state.",
  "type": "object",
  "required": ["schema_version", "sherpa", "harness_rev", "plan", "applied_at", "files"],
  "properties": {
    "schema_version": {"const": 1},
    "sherpa": {"type": "string", "description": "sherpa version that wrote the state"},
    "harness_rev": {"type": "string", "pattern": "^[0-9a-f]{12}$", "description": "hash over the content records — every markdown file or block sherpa owns; never over the sherpa version (ADR-0056); stamped on outcome labels"},
    "tooling": {"type": "string", "pattern": "^[0-9a-f]{12}$", "description": "hash over the non-content records (checker copy, hook, hook wiring, ignore file) plus the sherpa version; absent in a state written before ADR-0056"},
    "home": {"enum": [".agents", ".claude", ""], "description": "where owner docs, skills and the checker copy live (ADR-0015); empty before the first apply"},
    "targets": {"type": "array", "items": {"enum": ["claude", "agents-md"]}, "description": "runtimes projected into: Claude Code files, AGENTS.md hierarchy"},
    "plan": {
      "type": "object",
      "description": "trunk, rev and as_of of the applied plan",
      "additionalProperties": {"type": "string"}
    },
    "applied_at": {"type": "string", "description": "ISO-8601 UTC of the last write — the only clock in apply"},
    "files": {
      "type": "object",
      "description": "repo-relative path (\"/\" separated) → record",
      "additionalProperties": {
        "type": "object",
        "required": ["mode", "origin"],
        "additionalProperties": false,
        "properties": {
          "mode": {"enum": ["managed", "blocks", "json-hooks"], "description": "managed = whole file; blocks = marked blocks only; json-hooks = merged hook entries"},
          "origin": {"enum": ["generated", "adopted"]},
          "entry": {"type": "string", "description": "kind/target/scope of the plan entry; absent for base files"},
          "hash": {"type": "string", "pattern": "^[0-9a-f]{16}$", "description": "content hash, line endings normalised (managed, json-hooks); on a blocks file: present while the whole file is still sherpa's seed plus its blocks — apply --remove deletes it then (ADR-0048)"},
          "blocks": {"type": "object", "additionalProperties": {"type": "string", "pattern": "^[0-9a-f]{16}$"}, "description": "block name → hash of the inner text"}
        }
      }
    }
  }
}
