{
  "schema_version": 1,
  "sherpa": "0.7.9",
  "harness_rev": "27bae9de4fa5",
  "home": ".claude",
  "targets": [
    "claude"
  ],
  "plan": {
    "trunk": "origin/main",
    "rev": "f33bd38fd0b2698afd0f4f0302f9d2caa67d91a8",
    "as_of": "2026-09-19T07:06:43Z"
  },
  "applied_at": "2026-09-19T07:13:42Z",
  "files": {
    ".claude/agents/architect.md": {
      "mode": "managed",
      "origin": "adopted",
      "hash": "24a16d6345d283f8"
    },
    ".claude/commands/architect-review.md": {
      "mode": "managed",
      "origin": "adopted",
      "hash": "c47fbac94f1c5db2"
    },
    ".claude/commands/sync-kb.md": {
      "mode": "managed",
      "origin": "adopted",
      "hash": "99a3bba7f021e3a7"
    },
    ".claude/docs/modules/sherpa-harness.md": {
      "mode": "blocks",
      "origin": "generated",
      "entry": "owner-doc:sherpa-harness:",
      "hash": "eccdbea7cdf85373",
      "blocks": {
        "facts": "b6150870aa5de1ba"
      }
    },
    ".claude/docs/modules/src-sherpa-apply.md": {
      "mode": "blocks",
      "origin": "generated",
      "entry": "owner-doc:src/sherpa/apply:src/sherpa/apply",
      "hash": "cefb8f59757facd9",
      "blocks": {
        "facts": "d976ed6bffc4ac75"
      }
    },
    ".claude/hooks/sherpa-outcome.py": {
      "mode": "managed",
      "origin": "generated",
      "hash": "0673350c891d11ab"
    },
    ".claude/scripts/sherpa-check.py": {
      "mode": "managed",
      "origin": "generated",
      "hash": "488ce69139dbe210"
    },
    ".claude/settings.json": {
      "mode": "json-hooks",
      "origin": "generated",
      "hash": "23ef47bc78d3cdd0"
    },
    ".claude/skills/architect-review/SKILL.md": {
      "mode": "managed",
      "origin": "adopted",
      "hash": "77a74ed4d0e259af"
    },
    ".claude/skills/milestone-step/SKILL.md": {
      "mode": "managed",
      "origin": "adopted",
      "hash": "beef64217dd2affe"
    },
    ".claude/skills/sherpa-harness-sync/SKILL.md": {
      "mode": "blocks",
      "origin": "generated",
      "entry": "librarian:sherpa-harness:",
      "hash": "2f151a55c2786003",
      "blocks": {
        "scope": "23e2424c92fa524a"
      }
    },
    ".claude/skills/sync-kb/SKILL.md": {
      "mode": "managed",
      "origin": "adopted",
      "hash": "a90a780c534ea4b8"
    },
    ".sherpa/telemetry/.gitignore": {
      "mode": "managed",
      "origin": "generated",
      "hash": "240a3e0d37d2e86b"
    },
    "CLAUDE.md": {
      "mode": "blocks",
      "origin": "generated",
      "blocks": {
        "harness": "5013ffa9e78fc96c"
      }
    },
    "src/sherpa/apply/CLAUDE.md": {
      "mode": "blocks",
      "origin": "generated",
      "entry": "owner-doc:src/sherpa/apply:src/sherpa/apply",
      "hash": "d460b331acc5f65f",
      "blocks": {
        "harness": "d250b26f652b5a7b"
      }
    }
  }
}
